{
  "$schema": "https://github.com/focuslight-nr/mcp-servers/blob/main/packages/baseline-change-executor/schemas/fake-gaia-state-v1.schema.json",
  "target": "gateway-lab-01",
  "capturedAt": "2026-08-11T07:05:00.000Z",
  "observedByControl": {
    "ORG-GAIA-001": "One DNS server"
  },
  "supportedActions": ["gaia.setDnsServers"],
  "backupAvailable": true
}
